{
  "schema_version": "1.0.0",
  "kind": "map",
  "status": "partial",
  "source": {
    "mode": "git",
    "revision": "HEAD",
    "commit": "ec0ff50388c264ed8ce46f00967e92f7e71476ae",
    "tree": "d796d65cc1cb09fd6712c4b4707877bfc40daf17"
  },
  "coverage": [
    {
      "question": "analyzer_coverage",
      "scope": ".",
      "status": "unknown",
      "reasons": [
        "no_analyzer_report_attached"
      ]
    },
    {
      "question": "capabilities",
      "scope": ".",
      "status": "partial",
      "reasons": [
        "bounded_interface_and_capability_catalog"
      ]
    },
    {
      "question": "components",
      "scope": ".",
      "status": "partial",
      "reasons": [
        "bounded_declaration_catalog",
        "declarations_incomplete_or_local_references_unresolved"
      ]
    },
    {
      "question": "content",
      "scope": ".",
      "status": "complete",
      "reasons": []
    },
    {
      "question": "deployables",
      "scope": ".",
      "status": "partial",
      "reasons": [
        "bounded_deployable_catalog"
      ]
    },
    {
      "question": "interfaces",
      "scope": ".",
      "status": "partial",
      "reasons": [
        "bounded_interface_and_capability_catalog"
      ]
    },
    {
      "question": "packages",
      "scope": ".",
      "status": "unknown",
      "reasons": [
        "no_package_report_attached"
      ]
    },
    {
      "question": "routing",
      "scope": ".",
      "status": "unknown",
      "reasons": [
        "no_route_plan_evaluated"
      ]
    },
    {
      "question": "source_binding",
      "scope": ".",
      "status": "complete",
      "reasons": []
    }
  ],
  "coverage_ledger": [],
  "analyzer_coverage": [
    {
      "component_id": "component:6b8c542e023762c80978dad3f6a216c7",
      "language": "unknown",
      "language_basis": "unattributed",
      "tool": "bca",
      "descriptor_version": "1.0.0",
      "descriptor_source": "https://dekobon.github.io/big-code-analysis/",
      "expected_applicable": false,
      "ran": false,
      "covered_files": [],
      "not_covered": "unknown",
      "reason": "component_language_not_exactly_attributed"
    },
    {
      "component_id": "component:6b8c542e023762c80978dad3f6a216c7",
      "language": "unknown",
      "language_basis": "unattributed",
      "tool": "bifrost",
      "descriptor_version": "1.0.0",
      "descriptor_source": "https://bifrost.brokk.ai/capabilities/",
      "expected_applicable": false,
      "ran": false,
      "covered_files": [],
      "not_covered": "unknown",
      "reason": "component_language_not_exactly_attributed"
    },
    {
      "component_id": "component:6b8c542e023762c80978dad3f6a216c7",
      "language": "unknown",
      "language_basis": "unattributed",
      "tool": "noir",
      "descriptor_version": "1.0.0",
      "descriptor_source": "https://github.com/owasp-noir/noir",
      "expected_applicable": false,
      "ran": false,
      "covered_files": [],
      "not_covered": "unknown",
      "reason": "component_language_not_exactly_attributed"
    },
    {
      "component_id": "component:6b8c542e023762c80978dad3f6a216c7",
      "language": "unknown",
      "language_basis": "unattributed",
      "tool": "opentaint",
      "descriptor_version": "1.0.0",
      "descriptor_source": "https://github.com/seqra/opentaint",
      "expected_applicable": false,
      "ran": false,
      "covered_files": [],
      "not_covered": "unknown",
      "reason": "component_language_not_exactly_attributed"
    },
    {
      "component_id": "component:6b8c542e023762c80978dad3f6a216c7",
      "language": "unknown",
      "language_basis": "unattributed",
      "tool": "scc",
      "descriptor_version": "1.0.0",
      "descriptor_source": "https://github.com/boyter/scc",
      "expected_applicable": false,
      "ran": false,
      "covered_files": [],
      "not_covered": "unknown",
      "reason": "component_language_not_exactly_attributed"
    },
    {
      "component_id": "component:6b8c542e023762c80978dad3f6a216c7",
      "language": "unknown",
      "language_basis": "unattributed",
      "tool": "syft",
      "descriptor_version": "1.0.0",
      "descriptor_source": "https://github.com/anchore/syft",
      "expected_applicable": false,
      "ran": false,
      "covered_files": [],
      "not_covered": "unknown",
      "reason": "component_language_not_exactly_attributed"
    },
    {
      "component_id": "component:e9ee3680d831b31642d5e6fe8a5aaa42",
      "language": "unknown",
      "language_basis": "unattributed",
      "tool": "bca",
      "descriptor_version": "1.0.0",
      "descriptor_source": "https://dekobon.github.io/big-code-analysis/",
      "expected_applicable": false,
      "ran": false,
      "covered_files": [],
      "not_covered": "unknown",
      "reason": "component_language_not_exactly_attributed"
    },
    {
      "component_id": "component:e9ee3680d831b31642d5e6fe8a5aaa42",
      "language": "unknown",
      "language_basis": "unattributed",
      "tool": "bifrost",
      "descriptor_version": "1.0.0",
      "descriptor_source": "https://bifrost.brokk.ai/capabilities/",
      "expected_applicable": false,
      "ran": false,
      "covered_files": [],
      "not_covered": "unknown",
      "reason": "component_language_not_exactly_attributed"
    },
    {
      "component_id": "component:e9ee3680d831b31642d5e6fe8a5aaa42",
      "language": "unknown",
      "language_basis": "unattributed",
      "tool": "noir",
      "descriptor_version": "1.0.0",
      "descriptor_source": "https://github.com/owasp-noir/noir",
      "expected_applicable": false,
      "ran": false,
      "covered_files": [],
      "not_covered": "unknown",
      "reason": "component_language_not_exactly_attributed"
    },
    {
      "component_id": "component:e9ee3680d831b31642d5e6fe8a5aaa42",
      "language": "unknown",
      "language_basis": "unattributed",
      "tool": "opentaint",
      "descriptor_version": "1.0.0",
      "descriptor_source": "https://github.com/seqra/opentaint",
      "expected_applicable": false,
      "ran": false,
      "covered_files": [],
      "not_covered": "unknown",
      "reason": "component_language_not_exactly_attributed"
    },
    {
      "component_id": "component:e9ee3680d831b31642d5e6fe8a5aaa42",
      "language": "unknown",
      "language_basis": "unattributed",
      "tool": "scc",
      "descriptor_version": "1.0.0",
      "descriptor_source": "https://github.com/boyter/scc",
      "expected_applicable": false,
      "ran": false,
      "covered_files": [],
      "not_covered": "unknown",
      "reason": "component_language_not_exactly_attributed"
    },
    {
      "component_id": "component:e9ee3680d831b31642d5e6fe8a5aaa42",
      "language": "unknown",
      "language_basis": "unattributed",
      "tool": "syft",
      "descriptor_version": "1.0.0",
      "descriptor_source": "https://github.com/anchore/syft",
      "expected_applicable": false,
      "ran": false,
      "covered_files": [],
      "not_covered": "unknown",
      "reason": "component_language_not_exactly_attributed"
    },
    {
      "component_id": "component:f0f784ca9e255d1e94e691010110a240",
      "language": "unknown",
      "language_basis": "unattributed",
      "tool": "bca",
      "descriptor_version": "1.0.0",
      "descriptor_source": "https://dekobon.github.io/big-code-analysis/",
      "expected_applicable": false,
      "ran": false,
      "covered_files": [],
      "not_covered": "unknown",
      "reason": "component_language_not_exactly_attributed"
    },
    {
      "component_id": "component:f0f784ca9e255d1e94e691010110a240",
      "language": "unknown",
      "language_basis": "unattributed",
      "tool": "bifrost",
      "descriptor_version": "1.0.0",
      "descriptor_source": "https://bifrost.brokk.ai/capabilities/",
      "expected_applicable": false,
      "ran": false,
      "covered_files": [],
      "not_covered": "unknown",
      "reason": "component_language_not_exactly_attributed"
    },
    {
      "component_id": "component:f0f784ca9e255d1e94e691010110a240",
      "language": "unknown",
      "language_basis": "unattributed",
      "tool": "noir",
      "descriptor_version": "1.0.0",
      "descriptor_source": "https://github.com/owasp-noir/noir",
      "expected_applicable": false,
      "ran": false,
      "covered_files": [],
      "not_covered": "unknown",
      "reason": "component_language_not_exactly_attributed"
    },
    {
      "component_id": "component:f0f784ca9e255d1e94e691010110a240",
      "language": "unknown",
      "language_basis": "unattributed",
      "tool": "opentaint",
      "descriptor_version": "1.0.0",
      "descriptor_source": "https://github.com/seqra/opentaint",
      "expected_applicable": false,
      "ran": false,
      "covered_files": [],
      "not_covered": "unknown",
      "reason": "component_language_not_exactly_attributed"
    },
    {
      "component_id": "component:f0f784ca9e255d1e94e691010110a240",
      "language": "unknown",
      "language_basis": "unattributed",
      "tool": "scc",
      "descriptor_version": "1.0.0",
      "descriptor_source": "https://github.com/boyter/scc",
      "expected_applicable": false,
      "ran": false,
      "covered_files": [],
      "not_covered": "unknown",
      "reason": "component_language_not_exactly_attributed"
    },
    {
      "component_id": "component:f0f784ca9e255d1e94e691010110a240",
      "language": "unknown",
      "language_basis": "unattributed",
      "tool": "syft",
      "descriptor_version": "1.0.0",
      "descriptor_source": "https://github.com/anchore/syft",
      "expected_applicable": false,
      "ran": false,
      "covered_files": [],
      "not_covered": "unknown",
      "reason": "component_language_not_exactly_attributed"
    }
  ],
  "analyzer_blind_spots": [
    {
      "reason": "unknown",
      "entries": 18
    }
  ],
  "nodes": [
    {